{
  "schema": "purrtocol-variant/v1",
  "variant_id": "PKV-SCHRODINGER-OBS-001",
  "name": "ObserverPaw / Schrödinger-observed Purrtocol",
  "status": "implemented",
  "parent_variant_id": "PKV-CANONICAL",
  "origin": {
    "repository_url": "https://github.com/hopeless-t/chatgpt-recovery-dynamics",
    "commit": "8016a326c0b324dfd2884926c070228b5f44d36c",
    "submitted_by": "schrodinger-observatory",
    "pull_request_url": "https://github.com/hopeless-t/chatgpt-recovery-dynamics/pull/19"
  },
  "mutations": [
    "observation_mode=sealed_box_deterministic_ci",
    "selected_candidate=PKV-SEED-D9966B702AFA",
    "medium=pixel_sprite",
    "silhouette=retry_tanuki",
    "habitat=queueing_restaurant",
    "blocked_cue=queue_gate_closed",
    "recovering_cue=single_probe_orbit",
    "healthy_cue=stable_snapshot",
    "observation_prop=mini_trace_scope",
    "temperament=skeptical_archivist",
    "narrative_job=crawler_librarian",
    "mutation_class=tool_strain"
  ],
  "preserved_invariants": [
    "recover_dont_amplify",
    "visualization_not_evidence",
    "unknown_not_retry_permission",
    "observer_side_not_omniscient_backend",
    "concept_not_implemented",
    "first_success_not_necessarily_healthy",
    "observe_before_materialize"
  ],
  "evidence_status": "implemented_artifact",
  "license": "MIT",
  "homepage": "https://hopeless-t.github.io/chatgpt-recovery-dynamics/purrtocol-schrodinger/",
  "assets": [
    "docs/purrtocol-schrodinger/index.html",
    "docs/purrtocol-schrodinger/index.md",
    "docs/purrtocol-schrodinger/observation.json"
  ],
  "notes": "First implemented internal derivative selected only after the first CI observation. Candidate A was selected and copied into this implementation identity; candidate B remains an unpromoted concept. This is deterministic epistemic bookkeeping, not quantum physics.",
  "generator": {
    "genome_schema": "purrtocol-genome/v1",
    "genome_sha256": "b4804cd0149c0db743fefcae4b9f78b52490c6714e25fcf1ef2351c1ce8d4bfa",
    "name": "purrtocol-genome-breeder",
    "seed": "schrodinger-pakenya-box-001:A",
    "version": "1"
  },
  "genome": {
    "blocked_cue": "queue_gate_closed",
    "habitat": "queueing_restaurant",
    "healthy_cue": "stable_snapshot",
    "medium": "pixel_sprite",
    "mutation_class": "tool_strain",
    "narrative_job": "crawler_librarian",
    "observation_prop": "mini_trace_scope",
    "recovering_cue": "single_probe_orbit",
    "silhouette": "retry_tanuki",
    "temperament": "skeptical_archivist"
  }
}
